{"schema_id":"OPM-DEV-CANVAS-05-GATE-EVIDENCE-REPORT-001","schema_version":"0.1","gate_id":"GATE-05-04","status":"MATCHED","generated_at":"2026-07-30T13:43:23.494Z","command":["./mvnw","-o","-pl","services/local-runtime","-Dtest=OplTextGenerationServiceTest","test"],"source_refs":[{"kind":"SOURCE","path":"services/local-runtime/src/test/java/org/opm/localruntime/text/OplTextGenerationServiceTest.java","byte_length":165058,"sha256":"23de57303847734a24ac86a863fcb07f62ef83ad8cb176f039c01f69c301dadd"},{"kind":"SOURCE","path":"services/local-runtime/target/golden-replay/opm-opl-golden-replay-report.json","byte_length":215314,"sha256":"3e3c9d9e6e444e30ed86fbca9cf10e2923f236e7acd84630bdd68ee9efe5b3da"}],"raw_result":{"kind":"TEST_RESULT","path":"services/local-runtime/target/trace-closure/TEST-org.opm.localruntime.text.OplTextGenerationServiceTest.xml","byte_length":697342,"sha256":"444b7141d71de3eb67bb792a2b6eda70330850f7e027ab2c1f3f539761e356b2"},"summary":{"expected_cases":160,"observed_cases":160,"passed_cases":160,"failed_cases":0,"errors":0,"skipped":0,"checks":["130 个 PASS Golden case 的两次 replay 均写入非空 Trace SHA-256。","JDK 21 Surefire 原始 XML 已保留。"]}}